{
  "$schema": "http://adaptivecards.io/schemas/adaptive-card.json",
  "type": "AdaptiveCard",
  "version": "1.5",
  "body": [
    {
      "type": "TextBlock",
      "text": "Search Results for '${query}'",
      "weight": "Bolder",
      "size": "Medium"
    },
    {
      "type": "Container",
      "items": [
        {
          "type": "TextBlock",
          "text": "Results:",
          "weight": "Bolder",
          "spacing": "Small"
        },
        {
          "type": "Container",
          "items": [
            {
              "type": "TextBlock",
              "text": "${title}",
              "weight": "Bolder",
              "wrap": true
            },
            {
              "type": "TextBlock",
              "text": "${summary}",
              "isSubtle": true,
              "wrap": true
            },
            {
              "type": "ActionSet",
              "actions": [
                {
                  "type": "Action.OpenUrl",
                  "title": "View in Confluence",
                  "url": "${url}"
                }
              ]
            }
          ]
        }
      ]
    }
  ],
  "actions": [
    {
      "type": "Action.Submit",
      "title": "Next Page",
      "data": {
        "action": "nextPage",
        "page": "${page + 1}"
      }
    }
  ]
}
